{
  "name" : "Built-in",
  "services" : [
    "ios:bluetooth",
    "ios:calendar",
    "ios:contacts",
    "ios:files",
    "ios:location",
    "ios:messages",
    "ios:notifications",
    "ios:photos",
    "ios:reminders",
    "web:amazon.com",
    "web:americanexpress.com",
    "web:appstoreconnect.apple.com",
    "web:archive.ph",
    "web:chase.com",
    "web:chat.deepseek.com",
    "web:chat.z.ai",
    "web:chatgpt.com",
    "web:claude.ai",
    "web:console.typesafe.ai",
    "web:copilot.com",
    "web:creator.xiaohongshu.com",
    "web:ctrip.com",
    "web:developer.apple.com",
    "web:doubao.com",
    "web:en.wikipedia.org",
    "web:gemini.google.com",
    "web:github.com",
    "web:google.com",
    "web:grok.com",
    "web:huggingface.co",
    "web:instagram.com",
    "web:job-boards.greenhouse.io",
    "web:linkedin.com",
    "web:mail.google.com",
    "web:mixpanel.com",
    "web:models.dev",
    "web:mp.weixin.qq.com",
    "web:muse.ai",
    "web:news.ycombinator.com",
    "web:ourworldindata.org",
    "web:outlook.live.com",
    "web:qwen.ai",
    "web:secure.bankofamerica.com",
    "web:secure.chase.com",
    "web:taobao.com",
    "web:www.1point3acres.com",
    "web:www.airbnb.com",
    "web:www.doordash.com",
    "web:www.facebook.com",
    "web:www.fda.gov",
    "web:www.flightaware.com",
    "web:www.google.com",
    "web:www.kimi.com",
    "web:www.nature.com",
    "web:www.ncbi.nlm.nih.gov",
    "web:www.nejm.org",
    "web:www.perplexity.ai",
    "web:www.uscis.gov",
    "web:www.usta.com",
    "web:x.com",
    "web:xiaohongshu.com"
  ],
  "skills" : [

  ],
  "version" : 3
}
